{
  "schemaVersion": 1,
  "id": "cover-confirmed-example",
  "revision": 2,
  "origin": "userConfirmedImagePlayground",
  "state": "persisted",
  "userConfirmed": true,
  "provider": "apple",
  "externalProvider": false,
  "altText": "Synthetischer Vertragstest für ein bestätigtes Image-Playground-Cover",
  "assetRelativePath": "Covers/synthetic-only-placeholder.png",
  "sha256": "0000000000000000000000000000000000000000000000000000000000000000",
  "syntheticFixture": true
}
